{
  "dataset_class": "SYNTHETIC_INTERNAL",
  "synthetic": true,
  "disclaimer": "이 데이터는 TrustAgent 테스트와 시연을 위한 합성 승인 checklist 예시이며 실제 은행 내부자료나 실제 인간 승인 기록이 아닙니다.",
  "origin": "FIXTURE",
  "approved_checklist_version_id": "approved-checklist:2eaa5be6af97d149ee1d05a293c7e3a2",
  "family_id": "SIN-PREPAYMENT-FEE",
  "notice_id": "SIN-PREPAYMENT-FEE-V1",
  "created_at": "2026-09-14T00:00:00Z",
  "items": [
    {
      "item_order": 0,
      "rule_key": "CHECK_PREPAYMENT_FEE_RATE",
      "instruction": "기업여신 상담 시 중도상환수수료율 1.2퍼센트와 적용 조건을 원문 근거에서 확인한다.",
      "evidence_required": true,
      "structured_change": {
        "change_type": "NUMERIC_POLICY_CHANGE",
        "field_key": "prepayment_fee_rate_percent",
        "before_value": null,
        "after_value": "1.2",
        "unit": "PERCENT",
        "effective_on": "2026-09-15",
        "applicable_product_keys": [
          "kb-seller-loan"
        ],
        "conditions": [
          "기업 고객의 기업여신 상담 건"
        ],
        "exceptions": [
          "별도 약정으로 수수료 면제가 확인된 경우"
        ]
      },
      "source_rule_version_id": "policy-rule:sha256:82f74fb1981099301f8ba68f8984206fe60f45f288382d6161092ac5eef8d435"
    },
    {
      "item_order": 1,
      "rule_key": "CHECK_NOTICE_SOURCE",
      "instruction": "상담 안내 전 적용 공문 버전과 원문 근거 위치를 확인한다.",
      "evidence_required": true,
      "structured_change": null,
      "source_rule_version_id": "policy-rule:sha256:a72302da8f28a3b6d13bf74f835e9c6b7d967179c45b88f23e5d783336e03e3c"
    }
  ]
}
