{
  "dataset_class": "SYNTHETIC_INTERNAL",
  "synthetic": true,
  "disclaimer": "이 데이터는 TrustAgent 테스트와 시연을 위한 합성 승인 checklist 예시이며 실제 은행 내부자료나 실제 인간 승인 기록이 아닙니다. 공개 근거 교차 검증 테스트 용도다.",
  "origin": "FIXTURE",
  "approved_checklist_version_id": "approved-checklist:5741d977175e7637738a43d95aeb8c6d",
  "family_id": "SIN-SELLER-CHECKLIST",
  "notice_id": "SIN-SELLER-CHECKLIST-V1",
  "created_at": "2026-09-14T00:00:00Z",
  "items": [
    {
      "item_order": 0,
      "rule_key": "CHECK_CORPORATE_LIMIT_SOURCE",
      "instruction": "법인사업자 상담 준비 시 공개 상품 원문의 최대 20억원 표기와 근거 위치를 확인한다.",
      "evidence_required": true,
      "structured_change": null,
      "source_rule_version_id": "policy-rule:sha256:205820d6b50bd5de68dba8ef0e28dced40bea8d48932bc1b625bd04c1666fdac"
    },
    {
      "item_order": 1,
      "rule_key": "CHECK_HUMAN_REVIEW",
      "instruction": "자동 검증 결과와 별도로 담당자의 검토 기록을 남긴다.",
      "evidence_required": true,
      "structured_change": null,
      "source_rule_version_id": "policy-rule:sha256:daedcfc1e01db6cb47650ecf1d5a3ab0f1928c2916900cbdceb669046b07c5ff"
    }
  ]
}
